Title,Category,Provider,Format,Audience,Cost,Description,URL,Featured,Location,Date
AI in Education,EdTech & AI,King's College London (via FutureLearn),Online (self-paced),All staff,Varies,"Reworked King's College London course exploring AI's capabilities, limits and ethics across teaching, feedback and assessment, with hands-on 'try it out' activities.",https://www.futurelearn.com/courses/ai-in-education,,Online,
Free Self-Paced Courses (Teacher Academy),EdTech & AI,European School Education Platform (European Commission),Online (self-paced),All staff,Free,"EU's free Teacher Academy library of self-paced online tutorials and courses on AI, sustainability, literacy/numeracy, wellbeing and inclusive pedagogy.",https://school-education.ec.europa.eu/en/learn/self-paced-learning,,Online,
The Bell Foundation — EAL Online Courses (International Schools),Wellbeing & Inclusion,The Bell Foundation,Online (live),All staff,Varies,Evidence-informed EAL/multilingual-learner online courses and free webinars (Language for Results International) with an award-winning assessment framework for international schools.,https://www.bell-foundation.org.uk/our-work/with-international-schools/online-courses/,Yes,Online,
Chartered College of Teaching — International Affiliate,Subject & Pedagogy,Chartered College of Teaching,Online (self-paced),All staff,Subscription,"Low-cost international membership giving teachers free online CPD courses, Bitesize units, the Impact journal and 600+ research articles, plus a Chartered Status pathway.",https://chartered.college/membership/international-affiliate/,,Online,
EEF Teaching and Learning Toolkit,Subject & Pedagogy,Education Endowment Foundation,Online (self-paced),All staff,Free,"Free, regularly updated evidence summaries across 30+ teaching approaches (metacognition, feedback, oral language) with cost and evidence ratings to guide practice.",https://educationendowmentfoundation.org.uk/education-evidence/teaching-learning-toolkit,Yes,Online,
The Science of Well-Being (Yale),Wellbeing & Inclusion,Yale University (via Coursera),Online (self-paced),All staff,Free,"Yale's most-enrolled course (Prof. Laurie Santos), free to audit, teaching evidence-based habits to improve staff wellbeing and happiness.",https://www.coursera.org/learn/the-science-of-well-being,,Online,
